[
  {
    "id": "mahendragiri",
    "label": "Махендра",
    "name_iast": "Mahendragiri",
    "name_devanagari": "महेन्द्रगिरि",
    "modern_place": "Махендрагири, Одиша",
    "modern_wikidata": "Q6733785",
    "lat": 18.97,
    "lng": 84.36,
    "canonical_ref": "R.5.1",
    "source": "Гора, с которой Хануман прыгнул на Ланку",
    "alt_identification": "Точный пик спорен: помимо Махендрагири в Одише (Вост. Гхаты) предлагается и одноимённая гора в Тамилнаде (Q6733787)",
    "alt_source": "обзор в литературе; единого мнения нет"
  },
  {
    "id": "pampa-shabari",
    "label": "Пампа / ашрам Шабари",
    "name_iast": "Pampā / Śabarī-āśrama",
    "name_devanagari": "पम्पा / शबरी आश्रम",
    "modern_place": "Пампа-Саровар, Карнатака",
    "modern_wikidata": "Q2763469",
    "lat": 15.35,
    "lng": 76.48,
    "canonical_ref": "R.3.74; R.4.1",
    "source": "Озеро Пампа и ашрам Шабари; рядом с Кишкиндхой (Хампи/Анегунди)"
  }
]
